key	english	french
UP_Meri_700	(Turn back to Meriadoc.) "We have decided to go into the Pillar of Jor."	(Se retourner vers Meriadoc.) « On a décidé d'entrer dans le Pilier de Jor. »
UP_Meri_1076	"C'est vrai. We should make sure Ettir gets some questions as well."	« C'est vrai. On devrait s'assurer qu'Ettir reçoive aussi quelques questions. »
UP_Nessan_51	"Bonne question. I got some good info from that Freestrider fellow that Gourgalash had imprisoned."	« Bonne question. J'ai eu de bonnes infos de cet Errant que Gourgalash avait emprisonné. »
UP_Nessan_186	(Gesture towards Snell.) "You're still..."	(Faire un geste vers Snell.) « Tu es toujours... »
WL_Avikness_25	"Cool. Can you let me into that door over there?" (Point down the stairs.)	« Cool. Tu peux me laisser entrer par cette porte là-bas ? » (Pointer en bas des escaliers.)
WL_Avikness_76	(Hold it out) "Here. Draw a card."	(Le tendre) « Tenez. Tirez une carte. »
WL_Bookbinder_221	Just say-	Dis juste —
VL_Meeting_17	"No. It's mine." (Clutch it to your chest like a baby.)	« Non. C'est à moi. » (Le serrer contre ta poitrine comme un bébé.)
VL_Meeting_174	"And... what about him?" (Point to The Duck.)	« Et... lui alors ? » (Pointer Le Canard.)
VL_Meeting_288	<u>"I'll swear an oath to you. I will serve."</u>	<u>« Je vous prêterai serment. Je servirai. »</u>
VL_Meeting_289	"You will not be permitted in my city." (Attack.)	« Vous ne serez pas autorisé dans ma cité. » (Attaquer.)
VL_Meeting_535	Trempe-toi. Take the hits.	Trempe-toi. Encaisser les coups.
VL_Meeting_628	Trick the "helpers" first.	Tromper d'abord les « aides ».
VL_Meeting_727	(Look to the dark knight.) "<i>This</i> is what actual manhood looks like."	(Regarder le chevalier noir.) « <i>Voilà</i> à quoi ressemble la vraie virilité. »
VL_Meeting_729	(Turn to Kraaid.) "Oh, and your slogdogs are fucking disgusting."	(Se tourner vers Kraaid.) « Oh, et tes chiens-de-vase sont putain de dégoûtants. »
VL_Meeting_778	Those words... those are last words you hear.	Ces mots... ce sont les derniers mots que tu entends.
VL_Ost_63	"You know who this is?" (Point at Snell.)	« Tu sais qui c'est ? » (Pointer Snell.)
VL_Pinja_247	Parfait. What did I learn?	Parfait. Qu'ai-je appris ?
WL_Rollo_Modissa_29	Ask Snell, "The AY?"	Demander à Snell : « Le AY ? »
WL_Rollo_Modissa_69	"I'm a Bard, duh." (Show them some dance moves.)	« Je suis un Barde, évidemment. » (Leur montrer quelques pas de danse.)
WL_Rollo_Modissa_506	"So you're both doing something illegal. Then... let's compromise, right?" (Rompre le sort.)	« Donc vous faites tous les deux un truc illégal. Alors... compromis, non ? » (Rompre le sort.)
WL_TrashBin_21	"Hold on, I'm just gonna-" (Try to cast Comprehend Languages.)	« Attendez, je vais juste — » (Tenter de lancer Compréhension des Langues.)
WL_TrashBin_22	"Hold on, I'm just gonna-" (Essayer de lancer Druidisme.)	« Attendez, je vais juste — » (Essayer de lancer Druidisme.)
VL_Visken_126	"I have some other questions. Je crois."	« J'ai d'autres questions. Je crois. »
VL_Visken_133	I can't just tell him I'm suspicious of him and his helpers. Que devrais-je faire ?	Je peux pas juste lui dire que je le soupçonne, lui et ses aides. Que devrais-je faire ?
VL_Visken_162	(Turn around and whisper to Snell.) "What can you tell me about this guy?"	(Se retourner et chuchoter à Snell.) « Qu'est-ce que tu peux me dire sur ce gars ? »
VL_Visken_199	"I found this Mimic in the City Below." (Show him your scarf.)	« J'ai trouvé ce Mimique dans la Cité Inférieure. » (Lui montrer ton écharpe.)
VL_Visken_450	"Yes! Here you go." (Le lui tendre.)	« Oui ! Tenez. » (Le lui tendre.)
VL_Visken_724	"I have what I need." (Give back the paper.)	« J'ai ce qu'il me faut. » (Rendre le papier.)
VL_Visken_796	"You called me 'Cleric'." (Make air quotes.)	« Vous m'avez appelé 'Clerc'. » (Faire des guillemets aériens.)
VL_Visken_1470	(Glance at your companion. Whisper: "Not with him around.")	(Jeter un œil à ton compagnon. Chuchoter : « Pas avec lui dans le coin. »)
