LL_Intro	\"TRUTH AND NOTHING ELSE,\" a voice declares.	« RIEN QUE LA VÉRITÉ », déclare une voix.
LL_Intro	The weight of the Urthguard uniform. A dull pain takes hold.	Le poids de l'uniforme de la Garde-d'Urth. Une douleur sourde s'installe.
LL_Intro	You require <shake>HEALING</shake>.	Tu as besoin de <shake>SOINS</shake>.
LL_Intro	Your body aches. Its contents rotting.	Ton corps souffre. Son contenu pourrit.
LL_Intro	You must consume an apple. NOW.	Tu dois manger une pomme. MAINTENANT.
LL_Intro	There are many apples here. And corpses.	Il y a beaucoup de pommes ici. Et des cadavres.
LL_Intro	<i>CORPSES?</i> What the hells is this place?	<i>DES CADAVRES ?</i> Quel diable d'endroit est-ce ?
LL_Intro	Your mind forms a trail from one cross to another. You know not why you stand among these apples. But you know <i>everything else</i> that has gone wrong in your life.	Ton esprit trace un sentier d'une croix à l'autre. Tu ignores pourquoi tu te tiens parmi ces pommes. Mais tu sais <i>tout le reste</i> qui est allé de travers dans ta vie.
LL_Intro	You must dig yourself out of this trench. With kindness and an ever-brightening love for <i>folk</i>.	Tu dois sortir de cette tranchée. Avec bonté et un amour toujours plus éclatant pour le <i>peuple</i>.
LL_Intro	Your skull is broken - the content <i>whole</i>.	Ton crâne est brisé — son contenu <i>intact</i>.
LL_Intro	Bring yourself back from the brink. Find solace on the path and save the paladin from his madness. The flesh will thank you.	Reviens du bord du gouffre. Trouve le réconfort sur la voie et sauve le paladin de sa folie. La chair t'en remerciera.
LL_Intro	Worry not of pain. Care not of hunger.	Ne te soucie pas de la douleur. Ne te soucie pas de la faim.
LL_Intro	The CITY needs you. It needs your bones, ground into <i>pûlver</i> on the pavement.	La CITÉ a besoin de toi. Elle a besoin de tes os, réduits en <i>pûlver</i> sur le pavé.
LL_Intro	Do this, and your <i>one prayer</i> will be answered.	Fais cela, et ton <i>unique prière</i> sera exaucée.
LL_Intro	You have been routed for far too long.	Tu as été en déroute bien trop longtemps.
LL_Intro	Finish this task with precision and decisiveness, regain your position at the Towers, then return to your true task.	Achève cette tâche avec précision et résolution, regagne ta position aux Tours, puis retourne à ta vraie mission.
LL_Intro	Seizing <i>true power</i> in this forsaken city.	Saisir le <i>vrai pouvoir</i> dans cette cité maudite.
LL_Intro	You really have to get yourself another job. Seriously.	Tu dois vraiment trouver un autre boulot. Sérieusement.
LL_Intro	Once we've joined the Free Cities, you should consider leveraging your skills - become a freelancer! Or one of those well-paid <i>corporate agents</i>! You've already tried your hand at propaganda, and that didn't work out, so...	Une fois que nous aurons rejoint les Cités Libres, tu devrais songer à tirer parti de tes talents — deviens indépendant ! Ou l'un de ces <i>agents corporatifs</i> bien payés ! Tu as déjà tâté de la propagande, ça n'a pas marché, alors...
LL_Intro	Just take it easy. You might have failed at getting the first two- or three-hundred people to like you. But you've got half a million other folks to fool in this city!	Vas-y mollo. Tu as peut-être échoué à te faire aimer des deux ou trois cents premières personnes. Mais il te reste un demi-million d'autres âmes à berner dans cette cité !
LL_Intro	It is with utmost confidence that <i>you know</i>: eventually, someone has to love you.	C'est avec une absolue certitude que <i>tu sais</i> : un jour, quelqu'un finira par t'aimer.
LL_Intro	If your stats are high or low enough, <b>Chimes</b> will appear in your mind.	Si tes stats sont assez hautes ou basses, des <b>Tintements</b> apparaîtront dans ton esprit.
LL_Intro	They will suggest, inform, and offer unique paths. Trust them at your own risk.	Ils suggéreront, informeront, et offriront des voies uniques. Fais-leur confiance à tes risques et périls.
LL_Intro	\"I'm so very confused.\"	« Je suis vraiment confus. »
LL_Intro	\"Uh-huh.\" (Rub your temples.)	« Mmh-mmh. » (Se masser les tempes.)
LL_Intro	E-Okay. Thank you, voices in my head.	E-D'accord. Merci, voix dans ma tête.
LL_Intro	Yeah... it wasn't a great idea to follow your mom's footsteps.	Ouais... ce n'était pas une grande idée de suivre les traces de ta mère.
LL_Intro	It will be a long road, one you will inevitably travel. To surpass the Arcanists of old and become Wizard-God-King.	Ce sera une longue route, que tu emprunteras inévitablement. Pour surpasser les Arcanistes d'antan et devenir Roi-Dieu-Mage.
LL_Intro	A cheap currency in times of trouble. But you are ready to sacrifice them all - just like Urth teaches.	Une monnaie de pacotille en temps troubles. Mais tu es prêt à les sacrifier tous — comme Urth l'enseigne.
LL_Intro	It is a lot. Do not let that break your spirit.	C'est beaucoup. Ne te laisse pas briser l'esprit.
LL_Intro	A world of redemption lies at the end. All you have to do is retain exactly that which makes you truly, and unimaginably, <i>good</i>.	Un monde de rédemption attend à la fin. Tu n'as qu'à conserver exactement ce qui fait de toi quelqu'un de vraiment, et inimaginablement, <i>bon</i>.
LL_Intro	Your <i>stomach</i> yearns for the void.	Ton <i>estomac</i> appelle le vide.
LL_Intro	<i>Do not take the Flame Tongue</i>.	<i>Ne prends pas l'Épée Langue de Feu</i>.
LL_Intro	Well.	Bon.
LL_Intro	Let's aim for 'stand your presence' for now.	Visons « tenir debout » pour le moment.
LL_Intro	That's usually the case.	C'est généralement le cas.
LL_Intro	Your mind is ungodly powerful.	Ton esprit est d'une puissance impie.
LL_Intro	Get yourself together.	Reprends-toi.
LL_Intro	Just go to work. You know... get shit done.	Va simplement au boulot. Tu sais... fais le job.
LL_Intro	One step at a time.	Une étape à la fois.
LL_Intro	E-Get going.	E-En route.
LL_Intro	As you do, your fingers touch upon cold steel. It is covering your entire head.	Ce faisant, tes doigts touchent un acier froid. Il couvre toute ta tête.
LL_Intro	Colloquially known as a 'helmet'.	Familièrement appelé un « casque ».
LL_Intro	Can I take it off?	Puis-je l'enlever ?
LL_Intro	E-Okay. Thank you.	E-D'accord. Merci.
LL_Intro	<b>NO!</b>	<b>NON !</b>
LL_Intro	I wouldn't do that.	Je ne ferais pas ça.
LL_Intro	Like ripping off your own face.	Comme s'arracher le visage.
LL_Intro	Not a good idea.	Pas une bonne idée.
LL_Intro	<b>Not yet</b>.	<b>Pas encore</b>.
LL_Intro	Can't wait until you do.	Hâte de voir ça quand tu le feras.
